{
  "schema_version": 1,
  "created_at": "2025-11-13T17:58:43.985148+00:00",
  "backend": "Agg",
  "python": "3.12.10",
  "os": "Windows-11-10.0.26200-SP0",
  "git_sha": "7f2a0999d3d2fb2f54a3b98e9e16618b1f91166d",
  "sample_count": 240,
  "value_min": -2.617668133076367,
  "value_max": 3.279981009258173,
  "value_mean": 1.005982870017077,
  "value_stdev": 1.378459248198646,
  "duration_ms": 11950,
  "labels": {
    "pair": "DEMO/COL",
    "env": "dev"
  },
  "artifacts": {
    "png": ".artifacts\\demo_ctx_xrpl.png",
    "ndjson": ".artifacts\\demo_ctx_xrpl.ndjson"
  }
}